Glossary,Abbreviation,,,Explanation,,,,,,,,,,,,,,,,,,,,,,,,,,,,,,,,,,,,,,,,,,,,,,,,,,,,,,,,,,,,,,,,,,,,,,,,
EMV,EMV,,,"EMV are the international industry standards that define the rules for processing chip cards, originally named after the 3 organisations (Europay, MasterCard and Visa) that produced the specifications. The EMV standards and associated compliance processes are now managed by EMVCo. EMV is a registered trademark or trademark of EMVCo LLC in the United States and other countries.",,,,,,,,,,,,,,,,,,,,,,,,,,,,,,,,,,,,,,,,,,,,,,,,,,,,,,,,,,,,,,,,,,,,,,,,
EMV Mode (Contactless Only),,,,"An EMV mode transaction is a contactless payment, designed for markets that support the necessary infrastructure and protocols to meet all the EMV transaction data requirements.",,,,,,,,,,,,,,,,,,,,,,,,,,,,,,,,,,,,,,,,,,,,,,,,,,,,,,,,,,,,,,,,,,,,,,,,
EMV Level 1,EMVL1,,,"EMV Level 1 covers the electrical and physical interfaces, and the transmission of data, between the terminal and the card. There is an extensive EMVCo defined level 1 approval process, which requires every card reader to have completed laboratory type approval before they can be used to perform EMV transactions. EMVCo also require this approval to be renewed at defined intervals to retain compliance.",,,,,,,,,,,,,,,,,,,,,,,,,,,,,,,,,,,,,,,,,,,,,,,,,,,,,,,,,,,,,,,,,,,,,,,,
EMV Level 2,EMVL2,,,EMV Level 2 covers the set of functions that provide all the necessary processing logic and data that is required to select and process a card application in order to perform an EMV transaction.,,,,,,,,,,,,,,,,,,,,,,,,,,,,,,,,,,,,,,,,,,,,,,,,,,,,,,,,,,,,,,,,,,,,,,,,
,,,,"There is an extensive EMVCo defined level 2 approval process, which requires every EMV Kernel to have completed laboratory type approval before they can be used to perform EMV transactions. EMVCo also require this approval to be renewed at defined intervals to retain compliance.",,,,,,,,,,,,,,,,,,,,,,,,,,,,,,,,,,,,,,,,,,,,,,,,,,,,,,,,,,,,,,,,,,,,,,,,
EMVCo,EMVCo,,,"EMVCo (www.emvco.com), which is jointly owned by American Express, Discover, JCB, MasterCard, UnionPay and Visa - manage the EMV? standards and associated compliance processes.",,,,,,,,,,,,,,,,,,,,,,,,,,,,,,,,,,,,,,,,,,,,,,,,,,,,,,,,,,,,,,,,,,,,,,,,
Primary Account Number,PAN,,,The number found on every payment card that is linked to the cardholder's account and is used to identify where the transaction funds should be transferred to or from.,,,,,,,,,,,,,,,,,,,,,,,,,,,,,,,,,,,,,,,,,,,,,,,,,,,,,,,,,,,,,,,,,,,,,,,,
Personal Identification Number,PIN,,,"A secret number of between 4 and 12 digits that are known only by the cardholder and may be used during cardholder verification to confirm that the user of the card is the cardholder. The methods of PIN verification supported by EMV are Offline plain-text PIN, Offline enciphered PIN, and Online enciphered PIN.",,,,,,,,,,,,,,,,,,,,,,,,,,,,,,,,,,,,,,,,,,,,,,,,,,,,,,,,,,,,,,,,,,,,,,,,
Integrated Circuit Card,ICC,,,"An ICC is a card that contains a microprocessor chip. This chip can be used to perform EMV transactions on a payment terminal, and such a card is commonly referred to as a ""Chip and PIN"" card.",,,,,,,,,,,,,,,,,,,,,,,,,,,,,,,,,,,,,,,,,,,,,,,,,,,,,,,,,,,,,,,,,,,,,,,,
"""Chip and Pin""",,,,"""Chip and PIN"" is a marketing term used to describe the process of credit and debit card transactions using EMV-compliant microprocessor ""chip"" cards at a payment terminal and requiring the cardholder's PIN to be entered for verification.",,,,,,,,,,,,,,,,,,,,,,,,,,,,,,,,,,,,,,,,,,,,,,,,,,,,,,,,,,,,,,,,,,,,,,,,
Answer To Reset,ATR,,,"The ATR is the response from the card when it is reset during Card Detection and Reset, and specifies how the terminal must interface with the card, including which transmission protocol will be used to send and receive APDU between the terminal and the card. The ATR from the card determines which transmission protocol is used for APDU exchanges.",,,,,,,,,,,,,,,,,,,,,,,,,,,,,,,,,,,,,,,,,,,,,,,,,,,,,,,,,,,,,,,,,,,,,,,,
Application Identifier,AID,,,"An AID is used to uniquely identify each EMV application that a terminal supports, and every AID has an associated card scheme and parameters relating to how the application needs to be processed. A terminal may contain any number of such applications, and the list of each supported AID is used during Candidate List Creation to generate a list of applications that are mutually supported by both the terminal and the card.",,,,,,,,,,,,,,,,,,,,,,,,,,,,,,,,,,,,,,,,,,,,,,,,,,,,,,,,,,,,,,,,,,,,,,,,
Registered Application Provider Identifier,,RID,,"The RID is a fixed length unique identifier allocated to each card scheme to identify EMV applications provided by that scheme. The schemes may then suffix this with an optional PIX to further differentiate between multiple products supported by the scheme, and together they form the AID.",,,,,,,,,,,,,,,,,,,,,,,,,,,,,,,,,,,,,,,,,,,,,,,,,,,,,,,,,,,,,,,,,,,,,,,,
Proprietary Application Identifier Extension,,PIX,,"The PIX is an optional, variable length, suffix that may be allocated by card schemes to differentiate between multiple applications (e.g. credit and debit applications) provided by that scheme. The value of any PIX is proprietary for each scheme, and if present is appended to the RID to create the AID of each application.",,,,,,,,,,,,,,,,,,,,,,,,,,,,,,,,,,,,,,,,,,,,,,,,,,,,,,,,,,,,,,,,,,,,,,,,
Application Selection Indicator,ASI,,,"Each AID supported in the terminal has an associated Application Selection Indicator. During candidate list creation, if the AID matches an application on the card but the card's application name is longer than that of the AID, the terminal may only add the application to the candidate list if the Application Selection Indicator is set for that AID.",,,,,,,,,,,,,,,,,,,,,,,,,,,,,,,,,,,,,,,,,,,,,,,,,,,,,,,,,,,,,,,,,,,,,,,,
Candidate List Creation,,,,"The terminal has a list containing the Application Identifier (AID) of every EMV application that it is configured to support, and the terminal must generate a candidate list of applications that are supported by both the terminal and card. The terminal may attempt to obtain a directory listing of all card applications from the card's PSE. If this is not supported or fails to find a match, the terminal must iterate through its AID list asking the card whether it supports each individual AID.",,,,,,,,,,,,,,,,,,,,,,,,,,,,,,,,,,,,,,,,,,,,,,,,,,,,,,,,,,,,,,,,,,,,,,,,
,,,,"If there are multiple applications in the completed candidate list, or the application requires it, then the cardholder will be asked to choose an application  otherwise it may be automatically selected.",,,,,,,,,,,,,,,,,,,,,,,,,,,,,,,,,,,,,,,,,,,,,,,,,,,,,,,,,,,,,,,,,,,,,,,,
,,,,"Following successful completion of this step, the terminal proceeds to perform application selection.",,,,,,,,,,,,,,,,,,,,,,,,,,,,,,,,,,,,,,,,,,,,,,,,,,,,,,,,,,,,,,,,,,,,,,,,
Application Selection,,,,Application selection is performed after the candidate list has been created and the application to use has been chosen.,,,,,,,,,,,,,,,,,,,,,,,,,,,,,,,,,,,,,,,,,,,,,,,,,,,,,,,,,,,,,,,,,,,,,,,,
,,,,"The terminal must select the application on the card, so that the card can supply the correct data records for the transaction. Following successful completion of this step, the terminal proceeds to read application data.",,,,,,,,,,,,,,,,,,,,,,,,,,,,,,,,,,,,,,,,,,,,,,,,,,,,,,,,,,,,,,,,,,,,,,,,
Basic Encoding Rules - Tag Length Value,"BER-TLV, TLV",,,"Most data processed during an EMV transaction is encoded according to BER-TLV, as defined in the international standard ISO/IEC 8825-1. Each TLV data object consists of:",,,,,,,,,,,,,,,,,,,,,,,,,,,,,,,,,,,,,,,,,,,,,,,,,,,,,,,,,,,,,,,,,,,,,,,,
,,,,"A tag, which is used to uniquely identify the data object from the list of tags defined in EMV. All tags currently defined in the EMV specification are encoded over either 1 or 2 bytes (although cards may also contain proprietary data objects that can theoretically be longer).",,,,,,,,,,,,,,,,,,,,,,,,,,,,,,,,,,,,,,,,,,,,,,,,,,,,,,,,,,,,,,,,,,,,,,,,
,,,,"A length, which is used to indicate the length of data associated with the tag.",,,,,,,,,,,,,,,,,,,,,,,,,,,,,,,,,,,,,,,,,,,,,,,,,,,,,,,,,,,,,,,,,,,,,,,,
,,,,"A value, which contains the data associated with the tag.",,,,,,,,,,,,,,,,,,,,,,,,,,,,,,,,,,,,,,,,,,,,,,,,,,,,,,,,,,,,,,,,,,,,,,,,
TLV Tag Length Value,TLV,,,,,,,,,,,,,,,,,,,,,,,,,,,,,,,,,,,,,,,,,,,,,,,,,,,,,,,,,,,,,,,,,,,,,,,,,,,
Application Protocol Data Unit,APDU,,,"An APDU is a data unit transferred between the terminal and card. Any exchange of data is started by the terminal sending a Command-APDU, to which the card will reply with a Response-APDU. Every EMV transaction will consist of multiple APDU exchanges to read the data from the card and perform the necessary processing steps.",,,,,,,,,,,,,,,,,,,,,,,,,,,,,,,,,,,,,,,,,,,,,,,,,,,,,,,,,,,,,,,,,,,,,,,,
Response - Application Protocol Data Unit,R-APDU,,,An R-APDU is an APDU that is sent from the card to the terminal in response to a C-APDU received from the terminal.,,,,,,,,,,,,,,,,,,,,,,,,,,,,,,,,,,,,,,,,,,,,,,,,,,,,,,,,,,,,,,,,,,,,,,,,
Command - Application Protocol Data Unit,C-APDU,,,A C-APDU is an APDU that is sent from the terminal to the card whenever the terminal needs to communicate with the card.,,,,,,,,,,,,,,,,,,,,,,,,,,,,,,,,,,,,,,,,,,,,,,,,,,,,,,,,,,,,,,,,,,,,,,,,
Status Bytes,SW1 SW2,,"(1,1) Octets","The last 2 bytes of the R-APDU at the end of every APDU exchange between the terminal and the card will contain 2 status bytes, SW1 and SW2, which are used by the card to indicate the result of the processing to the terminal.",,,,,,,,,,,,,,,,,,,,,,,,,,,,,,,,,,,,,,,,,,,,,,,,,,,,,,,,,,,,,,,,,,,,,,,,
Payment System Environment,PSE,,,"The PSE is an optional mechanism for the card to store a directory structure that holds records containing a number of applications that are available on the card. When present, it is used during Candidate List Creation.",,,,,,,,,,,,,,,,,,,,,,,,,,,,,,,,,,,,,,,,,,,,,,,,,,,,,,,,,,,,,,,,,,,,,,,,
Card Detection and Reset,,,,"Card detection and reset needs to be performed by the card interface functions specific to the hardware device being used. When a card is reset, it will respond with an Answer To Reset (ATR) that specifies how the terminal must interface with the card.",,,,,,,,,,,,,,,,,,,,,,,,,,,,,,,,,,,,,,,,,,,,,,,,,,,,,,,,,,,,,,,,,,,,,,,,
Data Object List,DOL,,,"At several key stages of a transaction, the card requires data to be supplied from the terminal. Each of these stages has a specific DOL which is a list containing one or more pairs of tags and lengths (both encoded according to BER-TLV rules) but not values. When required, the terminal will process this list in order, appending each of the requested values (without tags or lengths) into a buffer which it will then send to the card. The card can then extract the value of each of these tags by using the DOL.",,,,,,,,,,,,,,,,,,,,,,,,,,,,,,,,,,,,,,,,,,,,,,,,,,,,,,,,,,,,,,,,,,,,,,,,
Transaction Certificate Data Object List,TDOL,,,"The TDOL is a list of data that the terminal must use as the input when it needs to calculate a transaction cryptogram hash, and the terminal may also store a default TDOL that can be used if the TDOL is not present in the data from the card. The terminal uses the DOL processing rules to format the requested data, but this is only required if the transaction cryptogram hash is required by either of the CDOL.",,,,,,,,,,,,,,,,,,,,,,,,,,,,,,,,,,,,,,,,,,,,,,,,,,,,,,,,,,,,,,,,,,,,,,,,
Issuer Script,ISP,,,"Sequence of Command-APDUs that the host sends to the terminal during online processing. These commands may be used for operations such as unblocking the PIN on a card, and the terminal must send each of these commands unaltered to the card. The issuer script results should then be reported to the acquirer in the clearing messages.",,,,,,,,,,,,,,,,,,,,,,,,,,,,,,,,,,,,,,,,,,,,,,,,,,,,,,,,,,,,,,,,,,,,,,,,
Issuer Application Data,IAD,,,,,,,,,,,,,,,,,,,,,,,,,,,,,,,,,,,,,,,,,,,,,,,,,,,,,,,,,,,,,,,,,,,,,,,,,,,
Payment System Environment,PSE,,,,,,,,,,,,,,,,,,,,,,,,,,,,,,,,,,,,,,,,,,,,,,,,,,,,,,,,,,,,,,,,,,,,,,,,,,,
Dedicated File,DF,,,,,,,,,,,,,,,,,,,,,,,,,,,,,,,,,,,,,,,,,,,,,,,,,,,,,,,,,,,,,,,,,,,,,,,,,,,
Master File,MF,,,The DF at the root is called the master file (MF). The MF is mandatory.  The other DFs are optional. ,,,,,,,,,,,,,,,,,,,,,,,,,,,,,,,,,,,,,,,,,,,,,,,,,,,,,,,,,,,,,,,,,,,,,,,,
File Control Information,FCI,,,,,,,,,,,,,,,,,,,,,,,,,,,,,,,,,,,,,,,,,,,,,,,,,,,,,,,,,,,,,,,,,,,,,,,,,,,
Elementary File,EF,,,"The following two types of EFs are defined :  Internal EF - Those EFs are intended for storing data interpreted by the card, i.e. data analyzed and used by the card for management and control purposes. Working EF - Those EFs are intended for storing data not interpreted by the card, i.e. data to be used by the outside world exclusively. ",,,,,,,,,,,,,,,,,,,,,,,,,,,,,,,,,,,,,,,,,,,,,,,,,,,,,,,,,,,,,,,,,,,,,,,,
Application Definition File,,ADF,,,,,,,,,,,,,,,,,,,,,,,,,,,,,,,,,,,,,,,,,,,,,,,,,,,,,,,,,,,,,,,,,,,,,,,,,,
Applicaton Elementary File,,AEF,,,,,,,,,,,,,,,,,,,,,,,,,,,,,,,,,,,,,,,,,,,,,,,,,,,,,,,,,,,,,,,,,,,,,,,,,,
Get Processing Options,GPO,,,Which EMV functionality does the card support?,,,,,,,,,,,,,,,,,,,,,,,,,,,,,,,,,,,,,,,,,,,,,,,,,,,,,,,,,,,,,,,,,,,,,,,,
Application File Locator,AFL,List Records,4 Octets,"The AFL is a list of application data records SFI present on the card, and the terminal will use the AFL to Read Application Data from the card. The AFL will also indicate which, if any, of the data records should be used by the terminal as part of the input to the data authentication process.",,,,,,,,,,,,,,,,,,,,,,,,,,,,,,,,,,,,,,,,,,,,,,,,,,,,,,,,,,,,,,,,,,,,,,,,
Short File Identifier,,SFI,1,The SFI is a reference to a file on the card.  The first byte of AFL. ,,,,,,,,,,,,,,,,,,,,,,,,,,,,,,,,,,,,,,,,,,,,,,,,,,,,,,,,,,,,,,,,,,,,,,,,
,,,2.3,"The second and third bytes are the first and last record to read. Imagine an AFL entry: “0E 01 03 02”. This entry requires the terminal to request record 1, 2 and 3 from file 0E.",,,,,,,,,,,,,,,,,,,,,,,,,,,,,,,,,,,,,,,,,,,,,,,,,,,,,,,,,,,,,,,,,,,,,,,,
,,,4,"The fourth byte indicates which records will be included in the data authentication process. In our example: “0E 01 03 02”, this means that record 1 and 2 will be used.",,,,,,,,,,,,,,,,,,,,,,,,,,,,,,,,,,,,,,,,,,,,,,,,,,,,,,,,,,,,,,,,,,,,,,,,
Application Interchange Profile,AIP,,2 Octets,"The AIP indicates which processing steps (e.g. cardholder verification, data authentication) are supported and which should be applied to the current transaction.",,,,,,,,,,,,,,,,,,,,,,,,,,,,,,,,,,,,,,,,,,,,,,,,,,,,,,,,,,,,,,,,,,,,,,,,
Application Usage Control,AUC,,2 Octets,"The Application Usage Control specifies any restrictions that may apply to the card that prevent the card from being used for certain types of transaction (e.g. cash-back) domestically or internationally, or at certain types of terminals (e.g. ATMs). The terminal will apply these checks ",,,,,,,,,,,,,,,,,,,,,,,,,,,,,,,,,,,,,,,,,,,,,,,,,,,,,,,,,,,,,,,,,,,,,,,,
,,,,during Processing Restrictions.,,,,,,,,,,,,,,,,,,,,,,,,,,,,,,,,,,,,,,,,,,,,,,,,,,,,,,,,,,,,,,,,,,,,,,,,
Read Application Data,,,,"Following application selection, the terminal provides the card with any data that it requests in the PDOL and gets the processing options. The card will supply the Application File Locator (AFL), which is used by the terminal to read the application data records from the card. ",,,,,,,,,,,,,,,,,,,,,,,,,,,,,,,,,,,,,,,,,,,,,,,,,,,,,,,,,,,,,,,,,,,,,,,,
,,,,"These records contain the card PAN and expiry date, plus many other tags of information that are used for transaction processing such as cardholder verification and card authentication.",,,,,,,,,,,,,,,,,,,,,,,,,,,,,,,,,,,,,,,,,,,,,,,,,,,,,,,,,,,,,,,,,,,,,,,,
,,,,"Following successful completion of this step, the terminal has sufficient data to proceed with the transaction processing, and may then perform data authentication, cardholder verification, processing restrictions and terminal risk management in any order.",,,,,,,,,,,,,,,,,,,,,,,,,,,,,,,,,,,,,,,,,,,,,,,,,,,,,,,,,,,,,,,,,,,,,,,,
,,,,,,,,,,,,,,,,,,,,,,,,,,,,,,,,,,,,,,,,,,,,,,,,,,,,,,,,,,,,,,,,,,,,,,,,,,,,
Processing Options Data Object List,PDOL,,,The PDOL is a list of data from the terminal that is required by the card at the beginning of the Read Application Data stage. The terminal uses the DOL processing rules to format the requested data and then sends it to the card in the Get Processing Options request.,,,,,,,,,,,,,,,,,,,,,,,,,,,,,,,,,,,,,,,,,,,,,,,,,,,,,,,,,,,,,,,,,,,,,,,,
,,,,Once an application is selected the card will respond with a Processing options Data Object List (PDOL). ,,,,,,,,,,,,,,,,,,,,,,,,,,,,,,,,,,,,,,,,,,,,,,,,,,,,,,,,,,,,,,,,,,,,,,,,
Offline Data Authentification,ODA,,,"There are three types of offline Data Authentication that can be performed, but the method to be used depends on the capabilities of the card and terminal. ",,,,,,,,,,,,,,,,,,,,,,,,,,,,,,,,,,,,,,,,,,,,,,,,,,,,,,,,,,,,,,,,,,,,,,,,
,,,,"Online-only terminals are not required to support data authentication, but all other terminals must support both SDA and DDA and may also support CDA.",,,,,,,,,,,,,,,,,,,,,,,,,,,,,,,,,,,,,,,,,,,,,,,,,,,,,,,,,,,,,,,,,,,,,,,,
Data Authentication,DA,,,"If both the terminal and the card support CDA then CDA should be used. If CDA is not supported but DDA is, then DDA should be used. If neither CDA nor DDA is supported but SDA is, then SDA should be used.",,,,,,,,,,,,,,,,,,,,,,,,,,,,,,,,,,,,,,,,,,,,,,,,,,,,,,,,,,,,,,,,,,,,,,,,
Combined DDA and Application Cryptogram Generation,,CDA,,Combined DDA and Application Cryptogram Generation.,,,,,,,,,,,,,,,,,,,,,,,,,,,,,,,,,,,,,,,,,,,,,,,,,,,,,,,,,,,,,,,,,,,,,,,,
Dynamic Data Authentication,,DDA,DDOL,Dynamic Data Authentication of card and terminal data to verify that the card application and data are genuine.,,,,,,,,,,,,,,,,,,,,,,,,,,,,,,,,,,,,,,,,,,,,,,,,,,,,,,,,,,,,,,,,,,,,,,,,
Static Data Authentication,,SDA,,Static Data Authentication of the card data (e.g. account number and expiry date) to verify that it has not been modified.,,,,,,,,,,,,,,,,,,,,,,,,,,,,,,,,,,,,,,,,,,,,,,,,,,,,,,,,,,,,,,,,,,,,,,,,
Dynamic Data Authentication Data Object List,DDOL,,,"The DDOL is a list of data that the card requires if the DDA method is used during Data Authentication, and the terminal may also store a default DDOL that can be used if the DDOL is not present in the data from the card.",,,,,,,,,,,,,,,,,,,,,,,,,,,,,,,,,,,,,,,,,,,,,,,,,,,,,,,,,,,,,,,,,,,,,,,,
,,,,The terminal uses the DOL processing rules to format the requested data and then sends it to the card in the Internal Authenticate command.,,,,,,,,,,,,,,,,,,,,,,,,,,,,,,,,,,,,,,,,,,,,,,,,,,,,,,,,,,,,,,,,,,,,,,,,
Card Risk Management Data Object List,CDOL,,,"A CDOL is a list of data that the card requires during Card Action Analysis, and there are 2 different CDOL that may be required during the course of a transaction. CDOL1 is used during the first card action analysis, and if a second card action analysis is required then CDOL2 is used.",,,,,,,,,,,,,,,,,,,,,,,,,,,,,,,,,,,,,,,,,,,,,,,,,,,,,,,,,,,,,,,,,,,,,,,,
,,,,The terminal uses the DOL processing rules to format the requested data and then sends it to the card in the Generate Application Cryptogram requests.,,,,,,,,,,,,,,,,,,,,,,,,,,,,,,,,,,,,,,,,,,,,,,,,,,,,,,,,,,,,,,,,,,,,,,,,
Certification Authority Public Key,CAPK,,,"In order to support Data Authentication or Offline enciphered PIN , the terminal must store a collection of public keys for each RID . When required, the card will supply a CAPK index which is used to identify which of these keys should be used for that transaction.",,,,,,,,,,,,,,,,,,,,,,,,,,,,,,,,,,,,,,,,,,,,,,,,,,,,,,,,,,,,,,,,,,,,,,,,
,,,,,,,,,,,,,,,,,,,,,,,,,,,,,,,,,,,,,,,,,,,,,,,,,,,,,,,,,,,,,,,,,,,,,,,,,,,,
,,,,,,,,,,,,,,,,,,,,,,,,,,,,,,,,,,,,,,,,,,,,,,,,,,,,,,,,,,,,,,,,,,,,,,,,,,,,
Cardholder Verification,,,,"Cardholder verification checks that the person using the card is the cardholder. The card contains a list of cardholder verification methods that it supports, and the conditions under which they should be applied. The terminal must navigate through this list and attempt the first method it finds for which the condition is met. If a method fails, the terminal must check whether additional methods are allowed.",,,,,,,,,,,,,,,,,,,,,,,,,,,,,,,,,,,,,,,,,,,,,,,,,,,,,,,,,,,,,,,,,,,,,,,,
,,,,"For example, a list might contain:",,,,,,,,,,,,,,,,,,,,,,,,,,,,,,,,,,,,,,,,,,,,,,,,,,,,,,,,,,,,,,,,,,,,,,,,
,,,,"Online enciphered PIN [if unattended cash], Offline plain-text PIN [if supported], signature [always].",,,,,,,,,,,,,,,,,,,,,,,,,,,,,,,,,,,,,,,,,,,,,,,,,,,,,,,,,,,,,,,,,,,,,,,,
,,,,,,,,,,,,,,,,,,,,,,,,,,,,,,,,,,,,,,,,,,,,,,,,,,,,,,,,,,,,,,,,,,,,,,,,,,,,
Cardholder Verification Method,CVM,,,"A CVM is a means of checking that the user of a card is the genuine cardholder and, during Cardholder Verification, the terminal will determine which CVM (if any) is required for the transaction. Common methods of cardholder verification include signature checking, and PIN entry.",,,,,,,,,,,,,,,,,,,,,,,,,,,,,,,,,,,,,,,,,,,,,,,,,,,,,,,,,,,,,,,,,,,,,,,,
Card Verification Results,CVR,,,,,,,,,,,,,,,,,,,,,,,,,,,,,,,,,,,,,,,,,,,,,,,,,,,,,,,,,,,,,,,,,,,,,,,,,,,
Offline enciphered PIN,,,,A CVM that verifies the cardholder's PIN by encrypting the entered PIN before sending it to the card. Terminals that support Offline enciphered PIN must also support the less secure Offline plain-text PIN method.,,,,,,,,,,,,,,,,,,,,,,,,,,,,,,,,,,,,,,,,,,,,,,,,,,,,,,,,,,,,,,,,,,,,,,,,
Offline plain-text PIN,,,,A CVM that verifies the cardholder's PIN by sending the unencrypted PIN to the card. This is commonly used by cards that can not support the more secure Offline enciphered PIN.,,,,,,,,,,,,,,,,,,,,,,,,,,,,,,,,,,,,,,,,,,,,,,,,,,,,,,,,,,,,,,,,,,,,,,,,
,,,,Terminals that support Offline plain-text PIN must also support the Offline enciphered PIN method.,,,,,,,,,,,,,,,,,,,,,,,,,,,,,,,,,,,,,,,,,,,,,,,,,,,,,,,,,,,,,,,,,,,,,,,,
Online enciphered PIN,,,,A CVM that verifies the cardholder's PIN by encrypting the entered PIN before sending it online to the card issuer.,,,,,,,,,,,,,,,,,,,,,,,,,,,,,,,,,,,,,,,,,,,,,,,,,,,,,,,,,,,,,,,,,,,,,,,,
Online Offline Decision,,,,The terminal must perform the action that the card requested during card action analysis by either performing online processing or proceeding directly to transaction completion.,,,,,,,,,,,,,,,,,,,,,,,,,,,,,,,,,,,,,,,,,,,,,,,,,,,,,,,,,,,,,,,,,,,,,,,,
Online Processing,,,,"Online processing enables the card issuer to analyse the transaction details and then decide whether it wishes to authorise or reject the transaction. This allows the issuer to check the account status and apply criteria based upon acceptable limits of risk defined by the card issuer, the payment scheme and the acquirer. If no valid response is received from the host (e.g. due to communications failure) then the terminal is required to perform additional Terminal Action Analysis to manage the increased level of risk, and this will result in the terminal informing the card that it proposes to either accept or decline the transaction locally.",,,,,,,,,,,,,,,,,,,,,,,,,,,,,,,,,,,,,,,,,,,,,,,,,,,,,,,,,,,,,,,,,,,,,,,,
,,,,The result of the online processing (or communications failure processing) will be used as an input during the second card action analysis.,,,,,,,,,,,,,,,,,,,,,,,,,,,,,,,,,,,,,,,,,,,,,,,,,,,,,,,,,,,,,,,,,,,,,,,,
Processing Restrictions,,,,"Processing restrictions allow the terminal to determine the compatibility of the applications on the card and terminal. This involves checking if their Application Version Numbers match, if the card application is expired or pre-valid, and whether the Application Usage Control (AUC) permits the current transaction to be performed.",,,,,,,,,,,,,,,,,,,,,,,,,,,,,,,,,,,,,,,,,,,,,,,,,,,,,,,,,,,,,,,,,,,,,,,,
,,,,,,,,,,,,,,,,,,,,,,,,,,,,,,,,,,,,,,,,,,,,,,,,,,,,,,,,,,,,,,,,,,,,,,,,,,,,
Terminal Risk Management,,,,"To safeguard against fraudulent use, the terminal will manage the level of risk by requiring certain transactions to be authorized online that would otherwise have been authorised locally.",,,,,,,,,,,,,,,,,,,,,,,,,,,,,,,,,,,,,,,,,,,,,,,,,,,,,,,,,,,,,,,,,,,,,,,,
,ATC,,,"This involves comparing the transaction amount against floor limits, and detecting when the number of consecutive offline transactions on a card has reached a defined limit. In addition, offline-capable terminals will also randomly select certain transactions to go online.",,,,,,,,,,,,,,,,,,,,,,,,,,,,,,,,,,,,,,,,,,,,,,,,,,,,,,,,,,,,,,,,,,,,,,,,
,LCOL,,,,,,,,,,,,,,,,,,,,,,,,,,,,,,,,,,,,,,,,,,,,,,,,,,,,,,,,,,,,,,,,,,,,,,,,,,,
,UCOL,,,,,,,,,,,,,,,,,,,,,,,,,,,,,,,,,,,,,,,,,,,,,,,,,,,,,,,,,,,,,,,,,,,,,,,,,,,
,,,,,,,,,,,,,,,,,,,,,,,,,,,,,,,,,,,,,,,,,,,,,,,,,,,,,,,,,,,,,,,,,,,,,,,,,,,,
,,,,,,,,,,,,,,,,,,,,,,,,,,,,,,,,,,,,,,,,,,,,,,,,,,,,,,,,,,,,,,,,,,,,,,,,,,,,
Card Risq Management,,,,,,,,,,,,,,,,,,,,,,,,,,,,,,,,,,,,,,,,,,,,,,,,,,,,,,,,,,,,,,,,,,,,,,,,,,,,
